Founders of Equestria;Princess Platinum, Clover the Clever, Commander Hurricane, Private Pansy, Chancellor Puddinghead, and Smart Cookie are six ponies who first discovered and founded the kingdom of Equestria long before the series' present day. Platinum, Hurricane, and Puddinghead served as the leaders of the unicorn, Pegasus, and Earth pony tribes respectively, and Clover, Pansy, and Smart Cookie were their advisors/seconds-in-command.;[Unicorn ,  Pegasus ,  Earth ];Female ;null;data:image/gif;base64,R0lGODlhAQABAIABAAAAAP///yH5BAEAAAEALAAAAAABAAEAQAICTAEAOw%3D%3D
Founders of Equestria;Princess Platinum, Clover the Clever, Commander Hurricane, Private Pansy, Chancellor Puddinghead, and Smart Cookie are six ponies who first discovered and founded the kingdom of Equestria long before the series' present day. Platinum, Hurricane, and Puddinghead served as the leaders of the unicorn, Pegasus, and Earth pony tribes respectively, and Clover, Pansy, and Smart Cookie were their advisors/seconds-in-command.;[Unicorn ,  Pegasus ,  Earth ];Female ;null;data:image/gif;base64,R0lGODlhAQABAIABAAAAAP///yH5BAEAAAEALAAAAAABAAEAQAICTAEAOw%3D%3D
Founders of Equestria;Princess Platinum, Clover the Clever, Commander Hurricane, Private Pansy, Chancellor Puddinghead, and Smart Cookie are six ponies who first discovered and founded the kingdom of Equestria long before the series' present day. Platinum, Hurricane, and Puddinghead served as the leaders of the unicorn, Pegasus, and Earth pony tribes respectively, and Clover, Pansy, and Smart Cookie were their advisors/seconds-in-command.;[Unicorn ,  Pegasus ,  Earth ];Female ;null;data:image/gif;base64,R0lGODlhAQABAIABAAAAAP///yH5BAEAAAEALAAAAAABAAEAQAICTAEAOw%3D%3D
Founders of Equestria;Princess Platinum, Clover the Clever, Commander Hurricane, Private Pansy, Chancellor Puddinghead, and Smart Cookie are six ponies who first discovered and founded the kingdom of Equestria long before the series' present day. Platinum, Hurricane, and Puddinghead served as the leaders of the unicorn, Pegasus, and Earth pony tribes respectively, and Clover, Pansy, and Smart Cookie were their advisors/seconds-in-command.;[Unicorn ,  Pegasus ,  Earth ];Female ;null;data:image/gif;base64,R0lGODlhAQABAIABAAAAAP///yH5BAEAAAEALAAAAAABAAEAQAICTAEAOw%3D%3D
Founders of Equestria;Princess Platinum, Clover the Clever, Commander Hurricane, Private Pansy, Chancellor Puddinghead, and Smart Cookie are six ponies who first discovered and founded the kingdom of Equestria long before the series' present day. Platinum, Hurricane, and Puddinghead served as the leaders of the unicorn, Pegasus, and Earth pony tribes respectively, and Clover, Pansy, and Smart Cookie were their advisors/seconds-in-command.;[Unicorn ,  Pegasus ,  Earth ];Female ;null;data:image/gif;base64,R0lGODlhAQABAIABAAAAAP///yH5BAEAAAEALAAAAAABAAEAQAICTAEAOw%3D%3D
Zecora;Zecora is a female zebra who resides in a hut in the Everfree Forest and first appears in Bridle Gossip. Initially believed to be an evil enchantress by the terrified populace of Ponyville, she later befriends the ponies and frequently helps them out with her knowledge of magical ailments. She speaks with a strong African-esque accent, forming rhyming couplets with all her sentences.;[Zebra Human ];Female;[Everfree Forest Zebrat, Farasi ];https://static.wikia.nocookie.net/mlp/images/e/e2/Zecora_id.png/revision/latest/scale-to-width-down/240?cb=20111117100832
Cranky Doodle Donkey;Cranky Doodle Donkey is a male donkey and Matilda's husband who first appears in the episode A Friend in Deed. His name is a pun on "Yankee Doodle Dandy", a famous song written by George M. Cohan in 1942.;[Donkey];Male;[In a cottage outside Ponyville];https://static.wikia.nocookie.net/mlp/images/b/b8/Cranky_Doodle_Donkey_in_Ponyville_S2E18.png/revision/latest/scale-to-width-down/240?cb=20120219234825
Matilda;Matilda is a female donkey and Cranky Doodle Donkey's wife who first appears in the episode A Friend in Deed. She has a brown coat and a curly dark-brown mane.;[Donkey];Female;[Ponyville];https://static.wikia.nocookie.net/mlp/images/a/a4/Matilda_ID_S2E18.png/revision/latest/scale-to-width-down/180?cb=20140122025448
Mulia Mild;Mulia Mild is a female mule and a baker who appears in MMMystery on the Friendship Express and Equestria Games. Her name and appearance are references to real-life chef Julia Child, the same basis as S06E12 Unnamed Unicorn Mare #5. The fact that mousse is French in origin may also be a reference, as Julia Child is known for popularizing French cuisine in America.;[Mule];Female;null;https://static.wikia.nocookie.net/mlp/images/0/06/Mulia_Mild_S2E24_thumb.png/revision/latest/scale-to-width-down/250?cb=20120518222112
Seabreeze;Seabreeze is a male and particularly outspoken Breezie who appears in the episode It Ain't Easy Being Breezies, in a flashback to It Ain't Easy Being Breezies in Twilight's Kingdom - Part 1, and in Twilight's Kingdom - Part 2.;[Breezie];Male;[Breezie Village];https://static.wikia.nocookie.net/mlp/images/0/0b/Seabreeze_ID_S4E16.png/revision/latest/scale-to-width-down/200?cb=20140304041658
Pharynx;Pharynx is a male changeling and the older brother of Thorax who is first mentioned in Triple Threat and physically debuts in To Change a Changeling.;[Changeling];Male;[Changeling Kingdom];https://static.wikia.nocookie.net/mlp/images/2/2b/Metamorphosed_Pharynx_ID_S7E17.png/revision/latest/scale-to-width-down/200?cb=20170904051337
Terramar;Terramar is a male Hippogriff/seapony and Silverstream's younger[1] brother who first appears as a supporting character in the season eight episode Surf and/or Turf.;[Hippogriff Seapony];Male;[Mount Aris Seaquestria];https://static.wikia.nocookie.net/mlp/images/6/67/Terramar_Hippogriff_form_ID_S8E6.png/revision/latest/scale-to-width-down/210?cb=20180421220730
Sky Beak and Ocean Flow;Sky Beak and Ocean Flow are the respective Hippogriff and seapony parents of Silverstream and Terramar. Sky Beak first appears in School Daze - Part 2, and Ocean Flow first appears in Surf and or Turf.;[Hippogriff];Male;[Mount Aris];https://static.wikia.nocookie.net/mlp/images/3/30/Sky_Beak_ID_S8E6.png/revision/latest/scale-to-width-down/170?cb=20180421220800
Steven Magnet;Steven Magnet is a male sea serpent who first appears in the episode Friendship is Magic, part 2. He was first named in merchandise, and later named in the season five episode Slice of Life, in which he is credited as "Stephen Magnet".;[Sea serpent];Male;[Everfree Forest river];https://static.wikia.nocookie.net/mlp/images/0/03/Steven_Magnet_ID_S5E09.png/revision/latest/scale-to-width-down/250?cb=20150615203155
Little Strongheart;Little Strongheart is a young female buffalo who first appears in Over a Barrel. Her name is in the style of a traditional Native American name, and her feathered headband is also part of the Native American motif shared among the buffalo herd.;[Buffalo];Female;[Tribe near Appleloosa];https://static.wikia.nocookie.net/mlp/images/8/8d/Little_Strongheart_ID_S1E21.png/revision/latest/scale-to-width-down/250?cb=20110826020839
Chief Thunderhooves;Chief Thunderhooves is the chief of a tribe of buffalo who first appears in the episode Over a Barrel. He leads the buffalo tribe against the settlers of Appleloosa, due to their apple orchards blocking his tribe's traditional stampeding grounds.;[Buffalo];Male;[Tribe near Appleloosa];https://static.wikia.nocookie.net/mlp/images/b/b1/Chief_Thunderhooves_ID_S1E21.png/revision/latest/scale-to-width-down/250?cb=20121225015011
Iron Will;Iron Will is a male minotaur and supporting character who first appears in the season two episode Putting Your Hoof Down. He travels around Equestria, holding assertiveness seminars. He has a habit of referring to himself in the third person and using various, often rhyming, catchphrases, such as, "When somepony tries to block, show them that you rock!";[Minotaur];Male;null;https://static.wikia.nocookie.net/mlp/images/c/cd/Iron_Will_ID.png/revision/latest/scale-to-width-down/250?cb=20140816233533
Gustave le Grand;Gustave le Grand[note 1] is a male griffon baker who appears in the episodes MMMystery on the Friendship Express, Equestria Games, and Princess Spike. He is the second griffon to appear in the series, after Gilda.;[Griffon];Male;null;https://static.wikia.nocookie.net/mlp/images/e/e9/Gustave_ID_S5E10.png/revision/latest/scale-to-width-down/250?cb=20160110204654
Scorpan;Scorpan is a male gargoyle prince and Lord Tirek's younger brother who appears in the IDW comics and is alluded to in the season four finale, My Little Pony Best Gift Ever, and A Trivial Pursuit.;[Gargoyle];Male;["A distant land"];https://static.wikia.nocookie.net/mlp/images/8/89/Scorpan_ID.png/revision/latest/scale-to-width-down/240?cb=20140514045708
The Smooze;The Smooze is a slime creature who first appears in the season five episode Make New Friends but Keep Discord. He is Discord's friend and guest to the Grand Galloping Gala. Though Discord mentions that the Smooze is genderless, he is often addressed with male pronouns.;null;null;null;https://static.wikia.nocookie.net/mlp/images/a/ab/Smooze_ID_S5E7.png/revision/latest/scale-to-width-down/200?cb=20150525190913
Grampa Gruff;Grampa Gruff, or Grandpa Gruff, is a male griffon and supporting character who first appears in the season five episode The Lost Treasure of Griffonstone. It is stated in The Hearth's Warming Club that he is "Grampa" in name only and does not have any familial grandchildren, contradictory to The Elements of Harmony Vol. II guidebook's identification of Gilda as his granddaughter; Jim Miller has stated that Gilda, Gavin, Gruff, and Gabby are unrelated[2] and that Gruff is Gallus' guardian but not grandfather.[3];[Griffon];Male;[Griffonstone];https://static.wikia.nocookie.net/mlp/images/c/c9/Grampa_Gruff_ID_S5E8.png/revision/latest/scale-to-width-down/230?cb=20160121053838
Greta;Greta is a female griffon and supporting character who first appears in The Lost Treasure of Griffonstone. She is Gilda's first griffon friend.;[Griffon];Female;[Griffonstone];https://static.wikia.nocookie.net/mlp/images/6/62/Greta_ID_S5E8.png/revision/latest/scale-to-width-down/180?cb=20150525214657
Capper;Capper is a male anthropomorphic cat who appears as a supporting character in My Little Pony The Movie. He also appears in the IDW comics and the season nine episodes Between Dark and Dawn and The Last Problem. He is a Klugetown con artist and former aristocrat from Abyssinia. He is called Capper Dapperpaws in some merchandise.;[Cat];Male;[Klugetown Panthera, Abyssinia ];https://static.wikia.nocookie.net/mlp/images/e/e6/Capper_ID_MLPTM.png/revision/latest/scale-to-width-down/220?cb=20171014193123
Captain Celaeno;Captain Celaeno[note 1] (/səˈlɑːnoʊ/ suh-LAH-noh) is a female anthropomorphic parrot who appears as a supporting character in My Little Pony The Movie and a central character in the chapter book Beyond Equestria: Rainbow Dash Rights the Ship. She is the captain of a crew of pirates that sails the Sea of Clouds beyond Equestria.;[Parrot];Female;[Ornithia ];https://static.wikia.nocookie.net/mlp/images/7/78/Captain_Celaeno_ID_MLPTM.png/revision/latest/scale-to-width-down/250?cb=20171014233919
Fluttershy (EG);Fluttershy's human counterpart appears in the My Little Pony Equestria Girls franchise. She is a student at Canterlot High School, an animal rescue center volunteer, and tambourine player for the Rainbooms.;[Human Pegasus];Female;[Human world];https://static.wikia.nocookie.net/mlp/images/9/9a/Fluttershy_ID_CYOE3.png/revision/latest/scale-to-width-down/220?cb=20180215211824
Pinkie Pie (EG);Pinkie Pie's human counterpart appears in the My Little Pony Equestria Girls franchise. She is a student at Canterlot High School and drummer for the Rainbooms.;[Human Earth];Female;[Human world];https://static.wikia.nocookie.net/mlp/images/6/6a/Pinkie_Pie_ID_EGDS.png/revision/latest/scale-to-width-down/210?cb=20180316034500
Applejack (EG);Applejack's human counterpart appears in the My Little Pony Equestria Girls franchise. She is a student at Canterlot High School and bass guitarist for the Rainbooms.;[Human Earth];Female;[Human world];https://static.wikia.nocookie.net/mlp/images/5/5d/Applejack_ID_EGDS4.png/revision/latest/scale-to-width-down/150?cb=20171106005320
Rarity (EG);Rarity's human counterpart appears in the My Little Pony Equestria Girls franchise. She is a student at Canterlot High School and keytarist for the Rainbooms.;[Human Unicorn];Female;[Human world];https://static.wikia.nocookie.net/mlp/images/7/7a/Rarity_ID_EGDS2.png/revision/latest/scale-to-width-down/150?cb=20171106005403
Rainbow Dash (EG);Rainbow Dash's human counterpart appears in the My Little Pony Equestria Girls franchise. She is a student at Canterlot High School and electric guitarist/lead vocalist for the Rainbooms.;[Human Pegasus];Female;[Human world];https://static.wikia.nocookie.net/mlp/images/1/1e/Rainbow_Dash_ID_EGDS2.png/revision/latest/scale-to-width-down/160?cb=20171106005353
Twilight Sparkle (Sci-Twi);Twilight Sparkle's human counterpart appears and is mentioned throughout the My Little Pony Equestria Girls franchise. She is a student at Canterlot High School, a former student of Crystal Prep Academy, and the owner of Spike the Dog. She is named Sci-Twi in some merchandise and other depictions. Her alter ego, Midnight Sparkle, appears as an antagonist in My Little Pony Equestria Girls: Friendship Games. From Legend of Everfree onwards, she is one of the main protagonists in the Equestria Girls franchise.;[Human Unicorn];Female;[Human world];https://static.wikia.nocookie.net/mlp/images/d/d2/Twilight_Sparkle_ID_EGDS5.png/revision/latest/scale-to-width-down/170?cb=20171106005251
Sunny Flare;Sunny Flare is a female human and one of the Crystal Prep Academy Shadowbolts in My Little Pony Equestria Girls: Friendship Games.;[Human];Female;[Human world];data:image/gif;base64,R0lGODlhAQABAIABAAAAAP///yH5BAEAAAEALAAAAAABAAEAQAICTAEAOw%3D%3D
Sour Sweet;Sour Sweet is a female human and one of the Crystal Prep Academy Shadowbolts in My Little Pony Equestria Girls: Friendship Games.;[Human];Female;[Human world];data:image/gif;base64,R0lGODlhAQABAIABAAAAAP///yH5BAEAAAEALAAAAAABAAEAQAICTAEAOw%3D%3D
Indigo Zap;Indigo Zap is a female human and one of the Crystal Prep Academy Shadowbolts in My Little Pony Equestria Girls: Friendship Games.;[Human];Female;[Human world];data:image/gif;base64,R0lGODlhAQABAIABAAAAAP///yH5BAEAAAEALAAAAAABAAEAQAICTAEAOw%3D%3D
Sugarcoat;Sugarcoat is a female human and one of the Crystal Prep Academy Shadowbolts in My Little Pony Equestria Girls: Friendship Games.;[Human];Female;[Human world];data:image/gif;base64,R0lGODlhAQABAIABAAAAAP///yH5BAEAAAEALAAAAAABAAEAQAICTAEAOw%3D%3D
Lemon Zest;Lemon Zest is a female human and one of the Crystal Prep Academy Shadowbolts in My Little Pony Equestria Girls: Friendship Games. In the film's closing credits, she is miscredited as Lemon Tart.;[Human];Female;[Human world];data:image/gif;base64,R0lGODlhAQABAIABAAAAAP///yH5BAEAAAEALAAAAAABAAEAQAICTAEAOw%3D%3D
DJ Pon-3 (EG);DJ Pon-3's human counterpart appears in the My Little Pony Equestria Girls franchise. She is a student at Canterlot High School.;[Human];Female;[Human world];https://static.wikia.nocookie.net/mlp/images/7/79/DJ_Pon-3_ID_EQG2.png/revision/latest/scale-to-width-down/120?cb=20150722032715
Cutie Mark Crusaders (EG);The Cutie Mark Crusaders' human counterparts appear in the My Little Pony Equestria Girls franchise. They are a trio of Canterlot High School freshmen consisting of Apple Bloom, Scootaloo, and Sweetie Belle.;[Human];Female;[Human world];https://static.wikia.nocookie.net/mlp/images/8/8a/Cutie_Mark_Crusaders_ID_EG3.png/revision/latest/scale-to-width-down/250?cb=20160308020633
Flash Sentry (EG);Flash Sentry's human counterpart appears in the My Little Pony Equestria Girls franchise. He is a student at Canterlot High School, electric guitarist for the band "Flash Drive", and Sunset Shimmer's ex-boyfriend.;[Human Pegasus];Male;null;https://static.wikia.nocookie.net/mlp/images/2/22/Flash_Sentry_ID_EGDS.png/revision/latest/scale-to-width-down/240?cb=20180222014052
Principal Celestia;Principal Celestia is a female human and Princess Celestia's human world counterpart in the My Little Pony Equestria Girls franchise. She is the principal of Canterlot High School and older sister of Vice Principal Luna.;[Human];Female;[Human world];https://static.wikia.nocookie.net/mlp/images/8/86/Principal_Celestia_human_ID_EG2.png/revision/latest/scale-to-width-down/100?cb=20141222002825
Vice Principal Luna;Vice Principal Luna is a female human and Princess Luna's human world counterpart in the My Little Pony Equestria Girls franchise. She is the vice principal of Canterlot High School and younger sister of Principal Celestia.;[Human];Female;[Human world];https://static.wikia.nocookie.net/mlp/images/c/c1/Vice_Principal_Luna_human_ID_EG2.png/revision/latest/scale-to-width-down/100?cb=20141222002813
Diamond Tiara and Silver Spoon (EG);Diamond Tiara and Silver Spoon's human counterparts appear in the My Little Pony Equestria Girls franchise. They are students at Canterlot High School.;[Human];Female;[Human world];https://static.wikia.nocookie.net/mlp/images/1/1f/Diamond_Tiara_and_Silver_Spoon_ID_EG3.png/revision/latest/scale-to-width-down/250?cb=20180110221506
Big McIntosh (EG);Big McIntosh's human counterpart appears in the My Little Pony Equestria Girls franchise. He is a graduate student[1] of Canterlot High School and a member of the Wondertones.;[Human];Male;[Human world];https://static.wikia.nocookie.net/mlp/images/1/17/Big_McIntosh_ID_EG.png/revision/latest/scale-to-width-down/120?cb=20130727071226
Photo Finish (EG);Photo Finish's human counterpart appears in the My Little Pony Equestria Girls franchise. She is a student at Canterlot High School and lead singer for the band "Photo Finish and the Snapshots".;[Human];Female;[Human world];https://static.wikia.nocookie.net/mlp/images/3/34/Photo_Finish_ID_EG3.png/revision/latest/scale-to-width-down/200?cb=20160307174944
Trixie (EG);Trixie Lulamoon is a female human and Trixie's human world counterpart in the My Little Pony Equestria Girls franchise. She is a student of Canterlot High School, the lead singer and guitarist for the band Trixie and the Illusions, a secondary antagonist in My Little Pony Equestria Girls: Rainbow Rocks, and a central character in My Little Pony Equestria Girls: Forgotten Friendship.;[Human];Female;[Human world];https://static.wikia.nocookie.net/mlp/images/3/37/Trixie_ID_CYOE17c.png/revision/latest/scale-to-width-down/140?cb=20200702205756
Trixie and the Illusions;Trixie and the Illusions are a student band that appears in the film My Little Pony Equestria Girls: Rainbow Rocks. The group consists of lead vocalist/electric guitarist Trixie Lulamoon and backup vocalists/sampler players "Lavender Lace" and Fuschia Blush.;null;Female;null;data:image/gif;base64,R0lGODlhAQABAIABAAAAAP///yH5BAEAAAEALAAAAAABAAEAQAICTAEAOw%3D%3D
Cheerilee (EG);Miss Cheerilee's human counterpart appears in the My Little Pony Equestria Girls franchise. She is a teacher and librarian at Canterlot High School.;[Human];Female;[Human world];https://static.wikia.nocookie.net/mlp/images/f/f3/Cheerilee_ID_EG.png/revision/latest/scale-to-width-down/150?cb=20150727231646
Granny Smith (EG);Granny Smith's human counterpart appears in the My Little Pony Equestria Girls franchise. She is Applejack, Apple Bloom, and Big McIntosh's grandmother and a teacher/lunch lady at Canterlot High School.;[Human];Female;[Human world];https://static.wikia.nocookie.net/mlp/images/7/77/Granny_Smith_ID_CYOE5b.png/revision/latest/scale-to-width-down/220?cb=20200115201725
Snips and Snails (EG);Snips and Snails' human counterparts appear in the My Little Pony Equestria Girls franchise. They are students at Canterlot High School and minor antagonists alongside Sunset Shimmer in the first film.;[Human];Male;[Human world];https://static.wikia.nocookie.net/mlp/images/d/db/Snips_and_Snails_ID_EG.png/revision/latest/scale-to-width-down/180?cb=20160313224123
Cranky Doodle Donkey (EG);Cranky Doodle Donkey's human counterpart appears in the My Little Pony Equestria Girls franchise. He is a teacher at Canterlot High School.;[Human];Male;[Human world];https://static.wikia.nocookie.net/mlp/images/c/c5/Cranky_Doodle_ID_EGDS10.png/revision/latest/scale-to-width-down/220?cb=20180115123333
Octavia Melody (EG);Octavia Melody's human counterpart appear in the My Little Pony Equestria Girls franchise. She is a student at Canterlot High School.;[Human];Female;[Human world];https://static.wikia.nocookie.net/mlp/images/1/1d/Octavia_Melody_ID_EG2.png/revision/latest/scale-to-width-down/150?cb=20141019023713
Lyra Heartstrings and Sweetie Drops (EG);Lyra Heartstrings and Sweetie Drops' human counterparts appear in the My Little Pony Equestria Girls franchise. They are students at Canterlot High School.;[Human];Female;[Human world];https://static.wikia.nocookie.net/mlp/images/2/2e/Lyra_Heartstrings_and_Sweetie_Drops_ID_EGDS4.png/revision/latest/scale-to-width-down/240?cb=20180110211830
Bulk Biceps (EG);Bulk Biceps' human counterpart appears in the My Little Pony Equestria Girls franchise. He is a student at Canterlot High School.;[Human];Male;[Human world];https://static.wikia.nocookie.net/mlp/images/5/57/Bulk_Biceps_ID_EG2.png/revision/latest/scale-to-width-down/240?cb=20141030160619
Maud Pie (EG);Maud Pie's human counterpart appears in the My Little Pony Equestria Girls franchise. She is a student at Canterlot High School and Pinkie Pie's older sister.;[Human];Female;[Canterlot, human world];https://static.wikia.nocookie.net/mlp/images/b/b5/Maud_Pie_ID_EGDS1.png/revision/latest/scale-to-width-down/150?cb=20180419190742
Zephyr Breeze (EG);Zephyr Breeze's human counterpart appears in the My Little Pony Equestria Girls franchise. He is a student at Canterlot High School.;[Human];Male;[Human world];https://static.wikia.nocookie.net/mlp/images/4/40/Zephyr_Breeze_ID_EGDS5.png/revision/latest/scale-to-width-down/160?cb=20171126010311
Violet Blurr and Pixel Pizzaz;Violet Blurr and Pixel Pizzaz, collectively known as the Snapshots, are two female characters associated with Photo Finish who first appear in My Little Pony Equestria Girls: Rainbow Rocks. They are unnamed in Equestria Girls animated media, but they are named in merchandise.;[Human];Female;null;https://static.wikia.nocookie.net/mlp/images/4/4d/Violet_Blurr_ID_EG2.png/revision/latest/scale-to-width-down/150?cb=20150508154339
Sandalwood;Sandalwood is a male human and Canterlot High School student in the My Little Pony Equestria Girls franchise. He is first named in the credits of the television broadcasts of the Rainbow Rocks and Friendship Games animated shorts, and first referred to by name in My Little Pony Equestria Girls: Sunset's Backstage Pass.;[Human];Male;[Human world];https://static.wikia.nocookie.net/mlp/images/4/41/Sandalwood_ID_EG.png/revision/latest/scale-to-width-down/200?cb=20130727072239
Micro Chips;Micro Chips is a male human and Canterlot High School student in the My Little Pony Equestria Girls franchise. He is named in the credits of the television broadcasts of the Rainbow Rocks and Friendship Games animated shorts, and he is first addressed by name in My Little Pony Equestria Girls: Rollercoaster of Friendship.;[Human];Male;[Human world];https://static.wikia.nocookie.net/mlp/images/b/bc/Micro_Chips_ID_EG.png/revision/latest/scale-to-width-down/200?cb=20130727075055
Derpy (EG);Derpy's human counterpart appears in the My Little Pony Equestria Girls franchise. She is a student at Canterlot High School and a member of a band.;[Human];Female;[Human world];https://static.wikia.nocookie.net/mlp/images/5/5a/Derpy_ID_EG2.png/revision/latest/scale-to-width-down/180?cb=20141231205307
Gloriosa Daisy;Gloriosa Daisy is a female human who appears as a supporting character and, briefly, the main antagonist in My Little Pony Equestria Girls: Legend of Everfree. She is the director of Camp Everfree and the older sister of Timber Spruce.;[Human Earth pony];Female;[Human world];https://static.wikia.nocookie.net/mlp/images/a/ab/Gloriosa_Daisy_full_ID_EG4.png/revision/latest/scale-to-width-down/150?cb=20161003183218
Timber Spruce;Timber Spruce is a male human who appears as a supporting character in the Equestria Girls franchise. He is a co-director and counselor of Camp Everfree, Gloriosa Daisy's younger brother, and human Twilight Sparkle's love interest.;[Human];Male;[Human world];https://static.wikia.nocookie.net/mlp/images/4/49/Timber_Spruce_full_ID_EG4.png/revision/latest/scale-to-width-down/170?cb=20161003213209
Canter Zoom;Canter Zoom is a male human who appears in the Equestria Girls film Legend of Everfree and the half-hour specials Movie Magic and Mirror Magic. He is a filmmaking director and Juniper Montage's uncle.;[Human];Male;[Human world];https://static.wikia.nocookie.net/mlp/images/5/5a/Canter_Zoom_full_ID_EGS2.png/revision/latest/scale-to-width-down/200?cb=20170626183509
Chestnut Magnifico;Chestnut Magnifico is a female human who appears as a supporting character in the Equestria Girls half-hour special Movie Magic. She is a renowned film actress and founder of an organization that helps homeless animals.;[Human];Female;[Human world];https://static.wikia.nocookie.net/mlp/images/c/c1/Chestnut_Magnifico_ID_EGS2.png/revision/latest/scale-to-width-down/140?cb=20170614003843
Constance;Constance is a background bird and one of Fluttershy's animal companions. She first appears in Friendship is Magic, part 1, and she is named in the season six episode Flutter Brutter.;[Bird];Female;[Treehung "house" near Fluttershy's Cottage (as of The Quest for the Lost Toy!)];https://static.wikia.nocookie.net/mlp/images/2/2f/Constance_ID_S6E11.png/revision/latest/scale-to-width-down/220?cb=20160711214023
